{
  "schemaVersion": "2.0.0",
  "kitVersion": "2.0.0",
  "language": "tr",
  "profile": "team",
  "artifactBackend": "native",
  "instructionBudgets": {
    "agentsTargetBytes": 12288,
    "agentsMaxBytes": 16384,
    "agentsTargetLines": 150,
    "agentsMaxLines": 200,
    "sessionContextMaxChars": 8000,
    "codexDefaultProjectDocMaxBytes": 32768
  },
  "workTracking": {
    "readOnly": "optional",
    "mutation": "required"
  },
  "archiveStrategy": "full",
  "adapters": {
    "codex": true,
    "claude": true,
    "superpowers": true
  }
}
